{
  "$schema": "https://json-schema.org/draft/2020-12/schema",
  "$id": "https://make-harness.local/schemas/review_report.schema.json",
  "title": "Review Worker Report",
  "description": "Structured review report with completion scoring, scenario flow scoring, gates, and rework items.",
  "type": "object",
  "additionalProperties": false,
  "required": [
    "task_id",
    "work_type",
    "status",
    "reviewed_outputs",
    "scope_check",
    "goal_contract_check",
    "overall_completion_score",
    "rubric_scores",
    "scenario_flow_scores",
    "score_threshold",
    "passed_threshold",
    "blocking_gates",
    "verification_check",
    "app_quality_check",
    "security_check",
    "secret_scan_result",
    "scope_diff_result",
    "command_audit",
    "budget_used",
    "independence",
    "rework_items",
    "next_iteration_recommendation",
    "risks_or_follow_up",
    "recommendation"
  ],
  "properties": {
    "schema_version": {
      "type": "string",
      "default": "1.0.0"
    },
    "task_id": {
      "type": "string",
      "minLength": 1
    },
    "work_type": {
      "enum": [
        "code_change",
        "docs",
        "schema_policy",
        "app_product",
        "research",
        "other"
      ]
    },
    "status": {
      "enum": [
        "accepted",
        "rejected",
        "needs_rework",
        "blocked",
        "validation_failed",
        "security_failed",
        "budget_exceeded",
        "consensus_failed"
      ]
    },
    "reviewed_outputs": {
      "$ref": "#/$defs/string_list_nonempty"
    },
    "scope_check": {
      "$ref": "#/$defs/check_result"
    },
    "goal_contract_check": {
      "$ref": "#/$defs/check_result"
    },
    "overall_completion_score": {
      "type": "integer",
      "minimum": 0,
      "maximum": 100
    },
    "rubric_scores": {
      "$ref": "#/$defs/rubric_scores"
    },
    "scenario_flow_scores": {
      "type": "array",
      "minItems": 1,
      "items": {
        "$ref": "#/$defs/scenario_flow_score"
      }
    },
    "score_threshold": {
      "type": "integer",
      "minimum": 85,
      "maximum": 100,
      "default": 85
    },
    "passed_threshold": {
      "type": "boolean"
    },
    "blocking_gates": {
      "type": "array",
      "items": {
        "enum": [
          "validation_failed",
          "security_failed",
          "budget_exceeded",
          "consensus_failed",
          "secret_or_sensitive_data_exposure",
          "workspace_escape",
          "symlink_target_outside_workspace",
          "changed_files_outside_allowed_files",
          "unapproved_file_delete_or_revert",
          "unauthorized_network_or_external_cost",
          "schema_validation_failed",
          "close_audit_failed",
          "build_failed",
          "lint_failed",
          "test_failed",
          "run_failed",
          "behavior_check_failed",
          "scenario_flow_failed",
          "app_quality_failed",
          "game_quality_failed",
          "playtest_failed",
          "asset_pipeline_failed",
          "performance_failed"
        ]
      }
    },
    "verification_check": {
      "$ref": "#/$defs/verification_check"
    },
    "app_quality_check": {
      "$ref": "#/$defs/app_quality_check"
    },
    "game_quality_check": {
      "$ref": "#/$defs/game_quality_check"
    },
    "security_check": {
      "$ref": "#/$defs/check_result"
    },
    "secret_scan_result": {
      "$ref": "#/$defs/check_result"
    },
    "scope_diff_result": {
      "$ref": "#/$defs/check_result"
    },
    "command_audit": {
      "type": "array",
      "items": {
        "$ref": "#/$defs/command_audit_entry"
      }
    },
    "budget_used": {
      "$ref": "#/$defs/budget_used"
    },
    "independence": {
      "enum": [
        "real_subagent",
        "simulated_same_context"
      ]
    },
    "rework_items": {
      "$ref": "#/$defs/string_list"
    },
    "next_iteration_recommendation": {
      "type": "string"
    },
    "risks_or_follow_up": {
      "$ref": "#/$defs/string_list"
    },
    "recommendation": {
      "enum": [
        "accepted",
        "needs_rework",
        "blocked",
        "rejected"
      ]
    }
  },
  "allOf": [
    {
      "if": {
        "properties": {
          "recommendation": {
            "const": "accepted"
          }
        },
        "required": [
          "recommendation"
        ]
      },
      "then": {
        "properties": {
          "status": {
            "const": "accepted"
          },
          "passed_threshold": {
            "const": true
          },
          "blocking_gates": {
            "maxItems": 0
          }
        }
      }
    },
    {
      "if": {
        "properties": {
          "status": {
            "const": "accepted"
          }
        },
        "required": [
          "status"
        ]
      },
      "then": {
        "properties": {
          "passed_threshold": {
            "const": true
          },
          "blocking_gates": {
            "maxItems": 0
          },
          "recommendation": {
            "const": "accepted"
          }
        }
      }
    },
    {
      "if": {
        "properties": {
          "blocking_gates": {
            "minItems": 1
          }
        },
        "required": [
          "blocking_gates"
        ]
      },
      "then": {
        "properties": {
          "passed_threshold": {
            "const": false
          },
          "status": {
            "not": {
              "const": "accepted"
            }
          },
          "recommendation": {
            "not": {
              "const": "accepted"
            }
          }
        }
      }
    },
    {
      "if": {
        "properties": {
          "passed_threshold": {
            "const": false
          },
          "status": {
            "enum": [
              "needs_rework",
              "validation_failed",
              "security_failed",
              "budget_exceeded",
              "consensus_failed"
            ]
          }
        },
        "required": [
          "passed_threshold",
          "status"
        ]
      },
      "then": {
        "properties": {
          "rework_items": {
            "minItems": 1
          }
        }
      }
    }
  ],
  "$defs": {
    "string_list": {
      "type": "array",
      "items": {
        "type": "string",
        "minLength": 1
      }
    },
    "string_list_nonempty": {
      "type": "array",
      "minItems": 1,
      "items": {
        "type": "string",
        "minLength": 1
      }
    },
    "check_result": {
      "type": "object",
      "additionalProperties": false,
      "required": [
        "status",
        "evidence"
      ],
      "properties": {
        "status": {
          "enum": [
            "passed",
            "failed",
            "not_run",
            "not_applicable"
          ]
        },
        "evidence": {
          "type": "string"
        },
        "findings": {
          "$ref": "#/$defs/string_list"
        }
      }
    },
    "score_detail": {
      "type": "object",
      "additionalProperties": false,
      "required": [
        "score",
        "max_score",
        "evidence"
      ],
      "properties": {
        "score": {
          "type": "integer",
          "minimum": 0
        },
        "max_score": {
          "type": "integer",
          "minimum": 1
        },
        "evidence": {
          "type": "string"
        }
      }
    },
    "rubric_scores": {
      "type": "object",
      "additionalProperties": false,
      "required": [
        "question_fulfillment",
        "functional_completeness",
        "scenario_flow_coverage",
        "edge_case_handling",
        "regression_safety",
        "verification_completeness"
      ],
      "properties": {
        "question_fulfillment": {
          "allOf": [
            {
              "$ref": "#/$defs/score_detail"
            },
            {
              "properties": {
                "score": {
                  "maximum": 25
                },
                "max_score": {
                  "const": 25
                }
              }
            }
          ]
        },
        "functional_completeness": {
          "allOf": [
            {
              "$ref": "#/$defs/score_detail"
            },
            {
              "properties": {
                "score": {
                  "maximum": 20
                },
                "max_score": {
                  "const": 20
                }
              }
            }
          ]
        },
        "scenario_flow_coverage": {
          "allOf": [
            {
              "$ref": "#/$defs/score_detail"
            },
            {
              "properties": {
                "score": {
                  "maximum": 30
                },
                "max_score": {
                  "const": 30
                }
              }
            }
          ]
        },
        "edge_case_handling": {
          "allOf": [
            {
              "$ref": "#/$defs/score_detail"
            },
            {
              "properties": {
                "score": {
                  "maximum": 10
                },
                "max_score": {
                  "const": 10
                }
              }
            }
          ]
        },
        "regression_safety": {
          "allOf": [
            {
              "$ref": "#/$defs/score_detail"
            },
            {
              "properties": {
                "score": {
                  "maximum": 5
                },
                "max_score": {
                  "const": 5
                }
              }
            }
          ]
        },
        "verification_completeness": {
          "allOf": [
            {
              "$ref": "#/$defs/score_detail"
            },
            {
              "properties": {
                "score": {
                  "maximum": 10
                },
                "max_score": {
                  "const": 10
                }
              }
            }
          ]
        }
      }
    },
    "scenario_flow_score": {
      "type": "object",
      "additionalProperties": false,
      "required": [
        "id",
        "score",
        "passed",
        "evidence"
      ],
      "properties": {
        "id": {
          "type": "string",
          "minLength": 1
        },
        "score": {
          "type": "integer",
          "minimum": 0,
          "maximum": 100
        },
        "passed": {
          "type": "boolean"
        },
        "evidence": {
          "type": "string"
        }
      }
    },
    "verification_check": {
      "type": "object",
      "additionalProperties": false,
      "required": [
        "build",
        "lint",
        "test",
        "run",
        "behavior_check"
      ],
      "properties": {
        "build": {
          "$ref": "#/$defs/check_result"
        },
        "lint": {
          "$ref": "#/$defs/check_result"
        },
        "test": {
          "$ref": "#/$defs/check_result"
        },
        "run": {
          "$ref": "#/$defs/check_result"
        },
        "behavior_check": {
          "$ref": "#/$defs/check_result"
        }
      }
    },
    "app_quality_check": {
      "type": "object",
      "additionalProperties": false,
      "required": [
        "ux_workflow_completeness",
        "visual_polish",
        "responsive_desktop_mobile",
        "accessibility_basics",
        "error_loading_empty_states",
        "text_overlap_layout_stability",
        "domain_fit",
        "evidence"
      ],
      "properties": {
        "ux_workflow_completeness": {
          "$ref": "#/$defs/check_result"
        },
        "visual_polish": {
          "$ref": "#/$defs/check_result"
        },
        "responsive_desktop_mobile": {
          "$ref": "#/$defs/check_result"
        },
        "accessibility_basics": {
          "$ref": "#/$defs/check_result"
        },
        "error_loading_empty_states": {
          "$ref": "#/$defs/check_result"
        },
        "text_overlap_layout_stability": {
          "$ref": "#/$defs/check_result"
        },
        "domain_fit": {
          "$ref": "#/$defs/check_result"
        },
        "evidence": {
          "type": "array",
          "minItems": 1,
          "items": {
            "$ref": "#/$defs/app_quality_evidence"
          }
        }
      }
    },
    "app_quality_evidence": {
      "type": "object",
      "additionalProperties": false,
      "required": [
        "type",
        "status",
        "description"
      ],
      "properties": {
        "type": {
          "enum": [
            "screenshot",
            "manual_behavior_check",
            "automated_test",
            "accessibility_check",
            "responsive_check",
            "not_applicable"
          ]
        },
        "status": {
          "enum": [
            "passed",
            "failed",
            "not_run",
            "not_applicable"
          ]
        },
        "description": {
          "type": "string",
          "minLength": 1
        },
        "artifact": {
          "type": "string",
          "minLength": 1
        }
      }
    },
    "game_quality_check": {
      "type": "object",
      "additionalProperties": false,
      "required": [
        "playable_core_loop",
        "rules_clarity",
        "controls_input_coverage",
        "game_state_lifecycle",
        "challenge_difficulty_progression",
        "feedback_game_feel",
        "hud_readability",
        "performance_render_stability",
        "asset_integrity",
        "browser_mobile_playability",
        "full_playthrough_evidence",
        "evidence"
      ],
      "properties": {
        "playable_core_loop": {
          "$ref": "#/$defs/check_result"
        },
        "rules_clarity": {
          "$ref": "#/$defs/check_result"
        },
        "controls_input_coverage": {
          "$ref": "#/$defs/check_result"
        },
        "game_state_lifecycle": {
          "$ref": "#/$defs/check_result"
        },
        "challenge_difficulty_progression": {
          "$ref": "#/$defs/check_result"
        },
        "feedback_game_feel": {
          "$ref": "#/$defs/check_result"
        },
        "hud_readability": {
          "$ref": "#/$defs/check_result"
        },
        "performance_render_stability": {
          "$ref": "#/$defs/check_result"
        },
        "asset_integrity": {
          "$ref": "#/$defs/check_result"
        },
        "browser_mobile_playability": {
          "$ref": "#/$defs/check_result"
        },
        "full_playthrough_evidence": {
          "$ref": "#/$defs/check_result"
        },
        "evidence": {
          "type": "array",
          "minItems": 1,
          "items": {
            "$ref": "#/$defs/game_quality_evidence"
          }
        }
      }
    },
    "game_quality_evidence": {
      "type": "object",
      "additionalProperties": false,
      "required": [
        "type",
        "status",
        "description"
      ],
      "properties": {
        "type": {
          "enum": [
            "playtest_note",
            "screenshot",
            "video_capture",
            "automated_test",
            "performance_trace",
            "asset_audit",
            "responsive_check",
            "manual_behavior_check",
            "not_applicable"
          ]
        },
        "status": {
          "enum": [
            "passed",
            "failed",
            "not_run",
            "not_applicable"
          ]
        },
        "description": {
          "type": "string",
          "minLength": 1
        },
        "artifact": {
          "type": "string",
          "minLength": 1
        }
      }
    },
    "command_audit_entry": {
      "type": "object",
      "additionalProperties": false,
      "required": [
        "command",
        "cwd",
        "purpose",
        "exit_code"
      ],
      "properties": {
        "command": {
          "type": "string",
          "minLength": 1
        },
        "cwd": {
          "type": "string",
          "minLength": 1
        },
        "purpose": {
          "type": "string",
          "minLength": 1
        },
        "exit_code": {
          "type": "integer"
        },
        "output_summary": {
          "type": "string"
        }
      }
    },
    "budget_used": {
      "type": "object",
      "additionalProperties": false,
      "required": [
        "iterations",
        "rework_iterations",
        "consensus_rounds",
        "subagents_started",
        "open_subagents"
      ],
      "properties": {
        "iterations": {
          "type": "integer",
          "minimum": 0
        },
        "rework_iterations": {
          "type": "integer",
          "minimum": 0
        },
        "consensus_rounds": {
          "type": "integer",
          "minimum": 0
        },
        "subagents_started": {
          "type": "integer",
          "minimum": 0
        },
        "open_subagents": {
          "type": "integer",
          "minimum": 0
        }
      }
    }
  }
}
